{
  "$schema": "https://json-schema.org/draft/2020-12/schema",
  "$id": "https://example.org/tsmm/schemas/tsmm-graph.schema.json",
  "title": "TSMM Graph Instance v0.10.0",
  "description": "Machine-readable graph representation of TSMM entities, relationships, and governance context.",
  "type": "object",
  "required": [
    "graphId",
    "label",
    "nodes",
    "edges"
  ],
  "properties": {
    "graphId": {
      "$ref": "#/$defs/idString"
    },
    "label": {
      "type": "string"
    },
    "description": {
      "type": "string"
    },
    "profile": {
      "type": "string"
    },
    "contexts": {
      "type": "array",
      "items": {
        "type": "string"
      }
    },
    "nodes": {
      "type": "array",
      "minItems": 2,
      "items": {
        "$ref": "#/$defs/node"
      }
    },
    "edges": {
      "type": "array",
      "minItems": 1,
      "items": {
        "$ref": "#/$defs/edge"
      }
    },
    "metadata": {
      "type": "object",
      "additionalProperties": {
        "type": [
          "string",
          "number",
          "boolean"
        ]
      }
    }
  },
  "$defs": {
    "idString": {
      "type": "string",
      "pattern": "^[A-Za-z0-9._:-]+$"
    },
    "nodeType": {
      "type": "string",
      "enum": [
        "TrustDomain",
        "GovernanceAuthority",
        "TrustRegistry",
        "RegistryService",
        "Issuer",
        "Verifier",
        "Subject",
        "Agent",
        "Credential",
        "Policy",
        "AssuranceProfile",
        "EvidenceBundle",
        "Assessment",
        "TrustDecision",
        "Effect",
        "RelyingParty"
      ]
    },
    "relationType": {
      "type": "string",
      "enum": [
        "governs",
        "defines",
        "operates",
        "registers",
        "authorizes",
        "issues",
        "verifies",
        "asserts",
        "delegates",
        "constrains",
        "substantiates",
        "assesses",
        "informs",
        "produces",
        "reliesOn",
        "anchors",
        "publishes"
      ]
    },
    "node": {
      "type": "object",
      "required": [
        "id",
        "type",
        "label"
      ],
      "properties": {
        "id": {
          "$ref": "#/$defs/idString"
        },
        "type": {
          "$ref": "#/$defs/nodeType"
        },
        "label": {
          "type": "string"
        },
        "description": {
          "type": "string"
        },
        "attributes": {
          "type": "object",
          "additionalProperties": {
            "type": [
              "string",
              "number",
              "boolean",
              "array",
              "object"
            ]
          }
        }
      },
      "additionalProperties": false
    },
    "edge": {
      "type": "object",
      "required": [
        "id",
        "type",
        "from",
        "to"
      ],
      "properties": {
        "id": {
          "$ref": "#/$defs/idString"
        },
        "type": {
          "$ref": "#/$defs/relationType"
        },
        "from": {
          "$ref": "#/$defs/idString"
        },
        "to": {
          "$ref": "#/$defs/idString"
        },
        "description": {
          "type": "string"
        },
        "conditions": {
          "type": "array",
          "items": {
            "type": "string"
          }
        },
        "evidenceRefs": {
          "type": "array",
          "items": {
            "$ref": "#/$defs/idString"
          }
        }
      },
      "additionalProperties": false
    }
  },
  "additionalProperties": false,
  "$comment": "This schema is part of the developer-facing contract for the TSMM-native repository. It exists both to enforce structural consistency and to make package expectations legible to contributors."
}